{
  "schema_version": "benchmark-matrix-result.v1",
  "run_id": "bench-matrix-20260702-032515",
  "generated_utc": "2026-07-02T03:25:43.1074192Z",
  "matrix_path": "./benchmarks/benchmark-matrix.v1.json",
  "rows": [
    {
      "id": "baseline-default-auth",
      "label": "Baseline/default auth profile",
      "status": "ok",
      "dimensions": {
        "auth_mode": "default",
        "room_scale": "2,10,20 peers",
        "command_mix": "map60/list60/blob20@4k",
        "reconnect_churn": "3 iterations",
        "guardrails": "none"
      },
      "scenario_result_path": "./benchmarks/results/bench-matrix-20260702-032515-baseline-default-auth-sdk-scenarios.json",
      "started_utc": "2026-07-02T03:25:15.1756994Z",
      "completed_utc": "2026-07-02T03:25:43.0924539Z",
      "aggregates": {
        "dotnet-host-runtime-alias": {
          "map_avg_ms": 308.648,
          "map_p95_ms": 325.582,
          "list_avg_ms": 572.849,
          "list_p95_ms": 582.741,
          "blob_avg_ms": 237.158,
          "blob_p95_ms": 243.341
        },
        "rust-combined-server": {
          "map_avg_ms": 271.344,
          "map_p95_ms": 276.084,
          "list_avg_ms": 461.568,
          "list_p95_ms": 476.132,
          "blob_avg_ms": 259.607,
          "blob_p95_ms": 303.208
        }
      },
      "gate": {
        "status": "baseline"
      }
    }
  ]
}
